{"schemaVersion":1,"kind":"final_reviewability_gate","status":"block","gate_result":"block","gate_reason":"total files 36 exceeds block threshold 25","metrics":{"reviewable_loc":40,"production_files":2,"total_files":36,"primary_surface_count":5,"primary_surfaces":["API","docs/process","other","scheduler/runtime","seed/config"],"greenfield":false,"thresholds":{"warn":{"reviewable_loc":400,"production_files":6,"total_files":15,"primary_surfaces":1},"block":{"reviewable_loc":800,"production_files":8,"total_files":25,"primary_surfaces":1}},"warnings":["total files 36 exceeds warn threshold 15","primary surfaces 5 exceeds warn threshold 1"],"blockers":["total files 36 exceeds block threshold 25"]},"exception":{"honored":false,"class":null,"evidence":[]},"blocked_operations":["pr-body-generation","single-pr-create","multi-pr-emission"],"timestamp":"2026-06-14T02:37:06Z","pr_created":false,"pr":null,"reslicing_packet_path":"specs/doc-002-unified-landing-page-and-ia-shell/.process/final-reviewability/reslicing-packet.json"}
