{"schemaVersion":1,"kind":"final_reviewability_gate","status":"exception","gate_result":"exception","gate_reason":"reviewable LOC 1322 exceeds warn threshold 400; production files 14 exceeds warn threshold 6; total files 55 exceeds warn threshold 15; primary surfaces 6 exceeds warn threshold 1","metrics":{"reviewable_loc":1322,"production_files":14,"total_files":55,"primary_surface_count":6,"primary_surfaces":["API","docs/process","other","scheduler/runtime","schema/migration","seed/config"],"greenfield":false,"thresholds":{"warn":{"reviewable_loc":400,"production_files":6,"total_files":15,"primary_surfaces":1},"block":{"reviewable_loc":800,"production_files":8,"total_files":25,"primary_surfaces":1}},"warnings":["reviewable LOC 1322 exceeds warn threshold 400","production files 14 exceeds warn threshold 6","total files 55 exceeds warn threshold 15","primary surfaces 6 exceeds warn threshold 1"],"blockers":["reviewable LOC 1322 exceeds block threshold 800","production files 14 exceeds block threshold 8","total files 55 exceeds block threshold 25"]},"exception":{"honored":true,"class":"infra","evidence":[{"path":"specs/doc-014-seo-and-ai-discoverability/spec.md","line":186,"class":"infra","provenance":"contract","branch_added":true,"honored":true,"reason":"accepted operator-owned typed exception"}]},"blocked_operations":[],"timestamp":"2026-06-26T01:38:34Z","pr_created":false,"pr":null,"reslicing_packet_path":null}
