{"schemaVersion":1,"kind":"final_reviewability_gate","status":"warn","gate_result":"warn","gate_reason":"total files 24 exceeds warn threshold 15; primary surfaces 4 exceeds warn threshold 1","metrics":{"reviewable_loc":0,"production_files":0,"total_files":24,"primary_surface_count":4,"primary_surfaces":["API","docs/process","scheduler/runtime","seed/config"],"greenfield":false,"thresholds":{"warn":{"reviewable_loc":400,"production_files":6,"total_files":15,"primary_surfaces":1},"block":{"reviewable_loc":800,"production_files":8,"total_files":25,"primary_surfaces":1}},"warnings":["total files 24 exceeds warn threshold 15","primary surfaces 4 exceeds warn threshold 1"],"blockers":[]},"exception":{"honored":false,"class":null,"evidence":[]},"blocked_operations":[],"timestamp":"2026-06-27T18:49:05Z","pr_created":false,"pr":null,"reslicing_packet_path":null}
